{
    "$schema": "http://json-schema.org/draft-07/schema#",
    "title": "TopTracks",
    "type": "array",
    "items": {
        "type": "object",
        "properties": {
            "artista": {
                "type": "string"
            },
            "musica": {
                "type": [
                    "string",
                    "null"
                ]
            },
            "popularidade": {
                "type": [
                    "integer",
                    "null"
                ]
            },
            "preview_url": {
                "type": [
                    "string",
                    "null"
                ]
            },
            "id": {
                "type": [
                    "string",
                    "null"
                ]
            },
            "duracao_ms": {
                "type": [
                    "integer",
                    "null"
                ]
            }
        },
        "required": [
            "artista"
        ]
    }
}